submitter_username,score_submission,content_submission,commenter_username,score_comment,content_comment,thread_id,url,submission_score,comment_score,improvement,sentiment_tracking_category
u/MountainStorm90,89,"2024 has been one of the worst years of my life Despite having nothing catastrophic happen to me, it seems like each month, I'm slipping deeper into this darkness. I'm in therapy and I think I hit a plateau in my progress. Rich people love to say that money doesn't solve all of your problems, but it's exactly what I need. I'm soon to be 34 and I got a very nice raise from work at the beginning of the year, but the goal post keeps getting moved out of reach. I'm a failure with a college degree. I'm stressed all of the time and I have suicidal thoughts at least 3-4 days out of the week. I bought a rope several months ago and my husband made a big deal about it when he found it, so now I've been better at keeping it all to myself. Now he thinks everything is fine and he doesn't care anymore. Nobody does. I feel like I'm an empty shell that's been deteriorating inside for the past year and a half and there's nothing left. I can't even cry anymore. I just hope every day for the relief of death. I have no friends and no family. Nobody would even notice I'm missing anyways. ",u/MountainStorm90,5,I'm so sorry. | That's so much loss for one year. I'm so sorry. I hope it does get better for you.,1fe37fx,https://www.reddit.com/r/depression/comments/1fe37fx/2024_has_been_one_of_the_worst_years_of_my_life/,-0.9954557418823242,-0.9996776580810547,-0.004221916198730469,neutral
u/Opening-Donkey-9906,391,"my best friend died My best friend passed away in a horrific car accident back in October, and I heard it happen as we'd just been together at my house, but I'd left a few minutes prior. I even drove past it on my way back from my errands, not realizing from the damage it was their vehicle (I think maybe my brain didn't want to realize it was them); since the accident, I've had a tough time, especially since we are only in our early 20s. I still find myself crying a lot three months later, and I carry a lot of guilt for reasons that led up to the crash, but since the accident, l've found it hard to leave my house besides going to work and find it hard to be around my other friends as it's just a constant reminder my best friend is dead. The few times I do hang out with my friends when they leave, I have horrible anxiety over it, and if I feel like the goodbye isn't good enough, I get scared because my goodbye to my best friend was very carefree. Even tonight, when one of my friends left, I broke down and cried. I've never handled a loss like this, and I want to feel semi-normal like my other friends do now, but I have a hard time moving past it and would like some advice. (I was diagnosed with depression in my
late teens but it’s the worse it’s ever been and even the medication isn’t working)",u/Opening-Donkey-9906,1,"Hi,
Thank you for your kind words. I was already in therapy before the accident, and my therapist did wonders for me with past issues, but this situation feels different. I’m sorry you had to go through a similar situation; if you don’t mind me asking, how long until you felt “normal” or a new normal? | I'm incredibly sorry for your loss. Please know it's not your fault. Managing your mental health is important, and you couldn't have foreseen this. I'm here for you if you need to talk or need anything. You're not alone in this. I understand the guilt aspect of it all, so do not hesitate to reach out",1964m0f,https://www.reddit.com/r/depression/comments/1964m0f/my_best_friend_died/,-0.9968518614768982,-0.744375467300415,0.25247639417648315,slight positive
u/Organic-Answer496,94,"I was making 100k as an engineer now I’m a broke uber driver Hey guys, I'm feeling pretty down right now and could use a pick me up. It's been a rough day of driving uber and just thinking about how I screwed up my life. I'm 28, and I currently have about 2k in savings. I drive Uber and do part time sales for a gym. I live in a house with 7 other people I barely know. When I was 24, I had about 50k in savings and was working at a big time bank as a software engineer making a little over 100k a year. I used to live in a penthouse apartment with 2 close roommates. But after the pandemic, I felt unfulfilled by the work and quit my job to pursue my passions. I ended up going down a rabbit hole of business ventures that ended up draining all my money and getting 12k of credit card debt. Very stupid I know. I did pull off some cool stuff and learned I have a passion for sales and marketing but for the most part Ive been feeling lost ever since and the only things that keep me going is working out and training MMA, which is how I ended up doing sales at a gym. The job market is really bad for software engineers and even then, I'm not 100% sure if I want to return to the profession as it still feels unfulfilling. Sales is fun for me but it's not enough shifts so I have to Uber to pay the rest of my bills. Because of that, this whole day I've been driving around professionals going in and out of their jobs and just been feeling like a failure all day. I plan on finding more sales work but currently I'm barely making ends meet to pay my bills and honestly feel like I have no value. I get really down thinking I may never have what I once had or find even a comfortable place financially. And it makes me feel stupider for doing what I did. I know 28 is young but the idea that I'll soon be 30 and be still struggling financially scares and depresses me. ",u/Organic-Answer496,13,"You’re absolutely right about early success and about letting go of the past. I think the biggest hinder towards making momentum to my future is that I keep comparing it to others and what I had in the past, and thats self sabotaging.  I’m sorry you went through the same. | Thank you. thats what i try to remind myself. My old boss actually admitted he wished he quit his job to pursue his passions when he was young and single but now it’s too late, so he admitted bwing envious of me for doing it. | So what do you do for money? | I appreciate that bro. Really. I do still got a lot of hustle in me, but the failures weigh me down sometimes.  Plus I get caught up with comparisons way too much. And that’s actually cool to know you’ve met others like that who drive Uber, sometimes I feel like I’m the only one lol. Thank you | lol that was actually one of my business ventures. Built an app and everything. But the business model wasn’t very good. And I needed funding to keep going. | Funny enough I do think I’m naturally better at sales than I ever was as an engineer. Plus there are easier employment opportunities in sales. I honestly just need to double down on finding good work in that, because when I am in the middle of it- i feel great. | It’s honestly been a legit thought for me. My gym has a UFC and OneFC fighter, plus a lot of local pros. I’ve gotten a few compliments for having legit hands lol. Have to put all this emotion somewhere I guess. | Thank you for sharing all this bro. You have a good mindset about baby steps and giving yourself grace by staying positive. Youre gonna go far with that. It truly is the past and negative thoughts that weigh us down. I appreciate you reaching out man, it’s good to know others are grinding here. we got this 💪  | I appreciate you sharing your story and also saying that you’re proud of me. Truly. Very few people in my life say that to me these days. My parents especially don’t. But I try to my own parent and be proud of myself, sometimes that gets an little weird and lonely though haha. And thank you for reminding me 30 is just a number, all these numbers are arbitrary and don’t mean anything. Life isn’t a constant uphill climb. Front end work is great but yea the market is tough now. I wish you success on your business. And I’m proud of you for making the leap and taking the world out on your own. It’s a tough and brutal journey only fit for the strong. | I’ve thought about it and sent a few applications to those positions, nothing yet. My sales resume isn’t as good as my engineering so i probably need more sales work to show my capabilities. | Damn dude. That’s real af. Now I feel the need to cheer you on lol. | Thank you brother I appreciate it ",1hbkw3j,https://www.reddit.com/r/depression/comments/1hbkw3j/i_was_making_100k_as_an_engineer_now_im_a_broke/,-0.9968255758285522,-0.7686566114425659,0.22816896438598633,slight positive
u/Original_Nebula7880,85,"my partner makes me wanna kill myself… I’ve been with this person for over 2 years and all he has brought is pain. I can’t remember the time where I was genuinely happy, everyday I cry, everyday I’m beaten physically and emotionally. I’m drained. I’m not the girl people used to see me as. All he has done is ruined my happiness. Everyday I look at the knife and think maybe it’s time to end this all so i can be at peace with my mind. Everytime I try to leave he just makes me feel like the worst person on earth for leaving him. I haven’t felt this alone and depressed since I was 13 and now I am 24 trying to figure out ways to just end this misery because of him. ",u/Original_Nebula7880,17,"Thank you. I’ve tried leaving and packed my bags and yet there he is master manipulator making me feel insane. Making me feel like I’m the cause of all the issues in the relationship. I never knew I would be a victim of DV until it got physical, It saddens me because I’m such a hypocrite to my own mother who was a DV victim from my dad.. Im currently saving money and packing my things secretly in order to leave once in for all. I appreciate your comment I truly do. | Thank you. I’m currently saving money and planing to leave secretly. I’ve joined a couple of support groups and recently got a therapist to talk about everything that’s been occurring and it has helped a lot since I’ve been bottling everything up for the past year. | One of my bestfriend knows the situation and helps me whenever she has time. Unfortunately my brother believes everything he says and is brain-washed by him. | It’s hard to leave that fast I’ve tried and he just manages his way back and letting me feel like I’ve made the wrong choice that I’m not thinking clearly. He’s very narcissistic and just imagine the way my own brother falls for his words.. my life before him I was very happy I used to have friends I used to have goals and now it’s all gone. He told me to give up on my friends and focus on the relationship since he’s the only friend I need. It’s a lot that happened. | There’s more to the story unfortunately.. let’s just say I had to do everything for him bills, take care of his mom day/night, pay his debt and yet again in his eyes I’m a shitty person.",1hclhuc,https://www.reddit.com/r/depression/comments/1hclhuc/my_partner_makes_me_wanna_kill_myself/,-0.9994661211967468,0.9892665147781372,1.988732635974884,significant positive
u/Other-Stop7953,313,"Life isn’t meant for everyone including me im not suicidal but Its not just depression, i dont like life or living. Its all too much work. Things to get, relationships. They all are too much work for me to invest in them. All the work for things that make me happy makes me unhappy. I’m kinda just existing. Realistically not staying alive would be a better option but i dont want to ruin my moms life by it so im trapped existing like a prison sentence. Ive never enjoyed life much except the rare times i have no work to do. I dont want anything from life tbh. Im over life. I have not lived long but i have seen enough already. 
*fyi i dont need a crises hotline just venting*",u/Other-Stop7953,7,"Emptiness is depression. Probably serotonin issue | Its too bad we already won the life lottery | The world is ending?… | Yeah some people like a challenge | Success is subjective i guess. But if u want it bad enough isnt it about discipline | Thanks. Its just hard to make effort to do hobbies | People in first world countries are suffering too. Its not a haven tbh | Im just too sensitive tbh. | I suppose i dont care to be strong but thanks | I dont want anything it has to offer. Too much work for little reward.  I dont play any sports | U need to take care of urself. Do exercise and make effort to see friends. Or ur just gonna spiral worse | https://jamanetwork.com/journals/jama/fullarticle/2815858#:~:text=Exercise%20tended%20to%20be%20about,doi:10.1001/jama.2024.1121 | I dont have ideation. The professionals just give meds | Wdym | Yeah the therapist looked disgusted and said i have general anxiety disorder and ocd. I just quit therapists. Don’t wanna take the drugs they give bc it can have permanent side effects | “Fixing” serotonin involves life changes. Hope ur issues resolve and it gets better",1fgyyi7,https://www.reddit.com/r/depression/comments/1fgyyi7/life_isnt_meant_for_everyone_including_me/,-0.9949936270713806,-0.9856315851211548,0.00936204195022583,neutral
u/OtherwisePanic1563,264,"Holidays are the worst I hate holidays. I also hate the fact that I hate holidays. I want to like them, but they always suck. They are just giant reminders of what I’ll never have and what I’ll never be apart of. I wish I could just fast forward through Thanksgiving and Christmas. ",u/OtherwisePanic1563,4,"Same. No family for me either. My husband hates holidays, decorations, all of it. That doesn’t help either. I don’t know if this feeling will ever go away. | I’m so sorry. I’m dealing/dealt with chronic pain too. I’m 34 so not too far away in age. It’s an added layer of awful. People expect you to “push through” the pain, especially during the holidays, if they even believe your pain is real in the first place. That’s an entirely different thread for sure. Hangin in there with you, friend. | I am actually a teacher and I’m so glad you shared this. I stopped doing “back from break” activities many years ago, and all of my teacher friends thought it was odd. These activities made me so upset when I was younger, and still even so as an adult. I taught in one of the wealthiest counties in my state and maybe 70% of the class would have a magical Disney trip or a skiing vacation in Colorado. I felt myself melting along with watching the dejected faces of the remaining 30% of the class. I finally decided I didn’t care what all the other teachers did; I refuse. Instead, we either completely ignore it or sometimes I’ll ask the kids “what’s the most boring thing you did over break?” I’ll tell them I deep cleaned or did taxes. So sick of catering to the wealthy few. They get enough catering as is. Done with that. | Wellll, I just posted in a domestic violence group asking about his behavior so I don’t know.",1h27wsf,https://www.reddit.com/r/depression/comments/1h27wsf/holidays_are_the_worst/,-0.9587931632995605,-0.51291823387146,0.4458749294281006,slight positive
u/Sadforever999,473,"Killing myself as a gift to the people around me! ✌️ 
Yall have pushed me soo fucking far!!! Finally today is the day. Kinda of weird how I’ve been waiting for this and it’s finally here. 

I’m usually stressed and saddened by the 
holidays but I feel a sense of relief maybe because I know I’m not going to have to deal with this anymore! 

Funny how people think I’m doing better too! I’ll make the best of my day go visit my favorite beach spot and grab my favorite food listen to my favorite music one last time

I know nobody will actually care and I’ve been hearing it for years “you’re too much to deal with, what about me!” so today is the gift everyone wants! 

Good bye everyone! 

If anyone I know or love comes across this thread after I’m gone just know I tried my hardest for the longest I could! 
And if you’re sad! “Get over it” just like you’ve told me! 

Does anyone even care!?  Friends and family don’t so why should strangers on some stupid fucking app!!! 

- still here but nobody’s heard from me! Haven’t been home! Seen posts asking about me. But still planning to end it! There will be a missing person report soon as it takes time for someone to be considered missing! I don’t plan on going back and only making want leave for good even more! 

",u/Sadforever999,110,Thanks to everyone reaching out!! I’m just sitting here in a puddle of tears not knowing what to do next! 😞💔,1hlkomg,https://www.reddit.com/r/depression/comments/1hlkomg/killing_myself_as_a_gift_to_the_people_around_me/,0.9918828010559082,-0.9680194854736328,-1.959902286529541,significant negative
u/TheBattleOfMyMind,83,"Fuck this shit.  Fuck the crisis team, fuck the mental health team, fuck them all, I HAVE ASKED FOR HELP IN EVERY SINGLE WAY THAT I CAN AND STILL GET DISCHARGED. The system is broken, even though they know how badly I’m doing, even though I told them nobody is gonna know shit now and I’ll stop draining nhs resources, nobody fucking listens. ",u/TheBattleOfMyMind,4,"I’m in the UK, I just got discharged from the team that can help me, because apparently intentionally harming myself is enough to have the referral rejected, and basically abandoned back to the gp who can’t really do fuck all. Bear in mind I fully implied that I won’t be here next week to answer their call of explanation. Told them I’m not ringing nobody, nobody is going to know shit, and I’ll stop being a drain on them. Basically got, I hear what you’re saying but I can’t do anything… byeee | This is the only place that will listen, the literal mental health team do not give a fuck, knowing that I’m a danger to myself right now, and they literally could not give two fucks and discharged me becuE I’m intentionally harming myself | It’s disgraceful. I’m in the uk I literally rang the crisis line twice this evening, and both times they did fuck all, even when I said if nobody wants to help me I may as well just go ahead with it, and hung up. | Thank you, I really appreciate this, but it’s hard not to feel hopeless when you’ve rang every professional you can, and each one has told me to call the other. The fucking crisis team told me to call the gp like what the actual fuck? “What do you want the crisis team to do?” Uhm maybe your fucking job. I’ve rang them twice tonight and both times I ended up hanging up on them because the first got annoyed and shitty with me for being suicidal, and the second was just a waste of time. I told second one before I hung up, I said what’s the point in asking for help if nobody is going to help me. I may as well go ahead with it. Do you think they called me back? Did they bollocks. | I rang my gp, they couldn’t do anything, told me to call crisis even though I didn’t want to. In the end I did ring them twice tonight and both times they didn’t give a fuck. Even though they know I’m suicidal, and they know my history. Something has to change | My reply to you is underneath, I must’ve accidentally untagged it or something | Been there, done that, got the T-shirt, I’ve told them am I fuck calling crisis again, what’s the point when they know I’m at crisis point, and can be a danger to myself, and they still fucking ignore me | I rang crisis, they were fucking useless. Hung up on her because she got annoyed at me wanting to kill myself. Guarantee she’s sending the police, idgaf | I rang crisis, she got shitty with me for being suicidal, and I hung up, they can get fucked. They’re actually disgraceful and I’m sorry you went through that. | u/kwyl and this, this is the state of the uk’s mental health service. All you have to do is search the crisis team in Reddit and you will hear hundreds of stories. | I didn’t mince my words, I rang the crisis team twice, they knew I can be a danger to myself. I was ignored. I have contacted everyone I’m supposed to, and nobody listened. One of the crisis team got annoyed with me for being suicidal. I give up on them all. | Unfortunately that’s not how it works here over the pond. I rang the people that can do something and was ignored even when I said I may as well just go ahead with it because nobody wants to help. | Haha, I am a seasoned pro in the cbt, 3 rounds, and just been discharged before the 4th could even go ahead because I was too high risk. Got referred to the neighbourhood team, they didn’t accept me, rang crisis twice last night asking them to send me back to home treatment, told them I may as well act on it if nobody wants to help. Nothing. Absolutely nothing. | How am I supposed to do that when I’ve called everyone I’m supposed to to ask for help, and the crisis team twice, the people that are supposed to organise help, and not only did they get shitty with me, they ignored the fact I was a danger to myself. I’m over it. | I absolutely agree. | Imagine the literally people you’re supposed to call for help getting annoyed at you for being dismissive because you’ve been let down by them one too many times. Oh wait. I don’t have to imagine. | Literally what’s just happened to me, was too high risk for talking therapies, referral sent to neighbourhood team, found out today they’ve fucked me off because I’m intentionally harming myself, I’m over it. | Oh don’t be silly crisis won’t take you to the hospital, they’ll do what they did with me last night, I rang twice, one got shitty with me for being suicidal so I hung up, rang back a while later and got told “what do you want the crisis team to do?” The first ever time I rang them the woman was amazing, and I ended up getting referred to the home treatment team. If you have that in your area it would be worth trying to get referred to them, they could come when your kids are at school.",1gmlpef,https://www.reddit.com/r/depression/comments/1gmlpef/fuck_this_shit/,-0.9997367262840271,-0.9988478422164917,0.0008888840675354004,neutral
u/TheRealGarbanzo,191,"I Think I Just Experienced How Dangerous Depression is and How Much Trouble I May Be in Last night, something happened. I took a walk to calm down and that's when I made a mistake.

I got high during this walk and went to the nearby train station to sit down for a while

Before I left I was having very bad thoughts. Thinking about how much easier things would be if I was just dead

An express Amtrak train was coming through the station. I didn't know it was an express train so I stood relatively close to the track (on the platform) so I could experience the train going by

The train that actually came, came by fast. It rumbled the ground, was loud. It honestly scared me as it flew past, the suction from the last few cars even moved me around slightly 

After this, I went to Wendy's and there I think I was able to uncover the real reason I feel the way I do. I have no direction in life. I feel like a failure already in my early 20s. I just dont see a future in which I'm happy

I'm sorry if this next part doesn't make sense
I'm trying to remember how I felt last night, laying down. I was scared, I never felt such a terror at the thought of what could be happening to me.

I felt like there's two different personalities in me and one of them is okay with dying and the other really isn't. And the one that really isn't okay with dying is being suppressed normally. But last night I think I felt it. The terror of knowing that there could be this thing inside me, alerting the way I think against my will. Making me think that suicide is the answer 

I'm not sure why I went to the station. I didn't have any intentions to do anything. But I wondered, ""what if I was feeling worse?"" If what I experienced isn't just from me being high, could whatever is making me think this way really win one day?

I know this didn't really make sense but I'm having trouble finding the words to describe what happened..

I just wanna ask, has any one you experienced something like this?",u/TheRealGarbanzo,32,"I'm glad you're still here | That does make sense | Sort of yeah. I was in control. But I can't help but feel like if I was in a worse state of mind. What would've happened

I know that my feelings were being amplified (definitely not getting high while feeling bad again)

But it was unlike anything I've ever experienced before. It's like a part of me opened up that was previously locked away | Absolutely. Thats exactly how it feels | Hopefully. Although im afraid that it could really get worse and I won't even be able to snap out of it eventually | You're definitely not alone. You may feel alone in your suffering but you're not. Take comfort in knowing that others feel the way you do too. Hopefully we can all overcome this | Yeah.. I understand. It's hard being alone AND dealing with depression. It's honestly really cruel how loneliness and depression complement each other | If you play games. We could play something sometime | Anytime",1gsmha3,https://www.reddit.com/r/depression/comments/1gsmha3/i_think_i_just_experienced_how_dangerous/,-0.9984388947486877,0.9865902662277222,1.98502916097641,significant positive
u/VentingVelvet,233,"Told husband I was depressed and he said he can't help me I was diagnosed with mild depression. I told my husband of 6 years (but known him for 12 years altogether) and his response was ""you should talk to your friends. I'm not great in giving pep talks. Understand that I can't help you."" 

I have no idea how to respond to that. I am a little bit upset. Is it a guy thing? Are they unable to handle big feelings of others?",u/VentingVelvet,1,Thank you. This is what I needed ❤️,1b8wlv5,https://www.reddit.com/r/depression/comments/1b8wlv5/told_husband_i_was_depressed_and_he_said_he_cant/,-0.9996095299720764,0.9997819066047668,1.9993914365768433,significant positive
