submitter_username,score_submission,content_submission,commenter_username,score_comment,content_comment,thread_id,url,submission_score,comment_score,improvement,sentiment_tracking_category
u/Vergissmein_,228,"My dad just said “I gave up on u” to me I don’t even where to start, it’s 6 in the morning and I’ve been crying for hours almost chock myself.
It’s all my fault if I have a daughter like myself i will also hate her. I used to be a no.1 honor student get all the A+ and now I don’t have any diploma and also not working. I got depression during university, failing all the classes and finally dropped out. The only thing i do is rotting in bed and listen to music. I want to change but didn’t know what to do, I am afraid if I fail again. I waste time and my parents’ money. I really want to end my life…Dad I am so sorry your life will be better without me.",u/Vergissmein_,19,"Your experience made me wanna cry again, I think it’s time to change. After some sleep I wanna apply back to college next year it’s cheaper and quicker for me to get a degree but I still don’t know what major should i choose cause I don’t have any hobbies anymore…Talking about going to gym, i really don’t have the energy to go out everyday but I will try some indoor activities, really thank you. | Thank you it really warms me up. I never went to see a psychiatrist or therapist cause I know it’s all my fault...if i could study harder or maybe changed the major earlier…I could never get in university again god another four years and that amount of money… | No and No, but deep in my heart I still don’t wanna give up. I saw my friend took medicine but it didn’t work so I never went to see a psychiatrist. But I will take the advice and go see one… | Thank you, and i hope one day your brother can get things back together. I think the reason was we used to be academically successful and one time lose really broke us to bottom, found out we didn’t that smart and could’t accept the reality…Life really know where’s our weakness spot to hit | Thank you so so much, my parents didn’t even say that to me when I got into university like I was supposed to get that, I will get myself together and never forget today. | That was awesome, if I didn’t quit I was gonna be the first to graduate too. I don’t know if I have the courage to study for 9 nines, that costs time and money, but I’m thinking go back to school. Thank you for your comment, great experience to learn. | Thank you, really thank you. Uni was hard for me, I hope ur doing better than me and please at least don’t drop out I’m truly regret everything I did. | You were much much brave than me, I wish you all the luck and graduate next year. You are absolutely stronger than you think, I will listen to your advice. Good luck to both of us! | I live 9385km away from my parents, sorry I didn’t mention he said that through a 4 am call. My parents divorced long time ago and my dad had the custody. I called him because I was having an emotional breakdown and I miss him, he signed and said that. | Thank you, you guys are so nice🥺 | Please don’t give up, students there years are struggling especially after Covid. It’s hard to graduate and even harder to get a job, but please don’t give up, math always have only one right answer, try YouTube or school tutor(I assume u in Uni?), they can help you! | If we are not friends what are we🥺👉🏻👈🏻 | Let’s hug😭",1ckojr9,https://www.reddit.com/r/depression/comments/1ckojr9/my_dad_just_said_i_gave_up_on_u_to_me/,-0.9993662238121033,0.99357008934021,1.9929363131523132,significant positive
u/anonymous_muffin_,230,"I'm exercising regularly, dieting religiously, working hard, getting sunlight every day, and and have even started seeing a councilor. I'm not even a little happier. I actually keep getting sadder as time goes on.

3 years ago I used to collapse randomly from depression and a lack of energy/willingness to keep standing.

It's started happening again.",u/anonymous_muffin_,1,"It used to be a fairly seasonal thing, but, in the last half year or so it's fairly sporadic. The sun could be shining on my face, perfect temperature, etc. and I'd still be miserable. It does definitely happen more often at night and when it is dark outside (cloudy, raining, winter, etc.) but by no means is it consistent enough to be considered a pattern. Nighttime definitely has a higher correlation than anything, but, recently even the daytime can't always save me. | Thank you a ton!

I do know that people say this (I mean, cheat days are a thing for a reason). But, after the first couple of months I didn't really need one save for every couple months or so. I think it may have something to do with having low-level Aspergers. We like consistency. If I've eaten nothing but canned tuna for two months, when it comes time for canned tuna the 5th time that week I'm going to go, ""Now this... This I love!""

I guess one thing that does frustrate me a tiny bit is the amount of effort vs the payoff. I go to the gym 5 times a week every week for 5+ months and I see basically no muscle. I am in the steepest caloric deficit medically recommended and I see some weightloss, but, it's not at the rate I see for others (I know comparison is the thief of joy, but, at some point who have to look around and go, ""Okay... What am I doing wrong?""). I work so hard I have literally given up weekends and sleep to produce insane results and I just have to cross my fingers and hope for a good promotion the end of the fiscal year.

Idk. I worry I'm falling into the trap of my generation needing instant gratification, but, it does feel like hard work pays off a lot less for me than it does for others sometimes.",1ffddwm,https://www.reddit.com/r/depression/comments/1ffddwm/im_exercising_regularly_dieting_religiously/,-0.9983559250831604,-0.9927478432655334,0.005608081817626953,neutral
u/arbitraryinsanity,88,"i fucking hate everyone i hate myself i hate other people i hate my country and i want to fucking die God i fucking hate everything. I want to kill. I want to murder. I want to fucking take your stupid face and cut your nose off with some blunt sheers. You fucking cunt.

God I fucking hate this world. I'm just fucking existing, living in my divorced dad's house at the age of 28 and making 50k CAD per year. IT'S NOT ENOUGH. I can't get a mortgage. I have zero friends. My dick seemingly doesn't work. I tried fucking hookers and my dick literally just doesn't work. Maybe because I'm depressed. God i fucking hate it. I hate my city. It's a bunch of fucking druggies. And if it's not druggies it's old beyond boomers who I can't relate with. God i fucking hate boomers. I hate my generation too. Don't get me wrong. I hate everybody equally. 

I wonder if I can ever really truly be happy? The last time I felt happy was 4th grade. I doubt those feelings are coming back anytime soon.",u/arbitraryinsanity,-1,I'm lost. | Which drug? Be specific.,1fwe315,https://www.reddit.com/r/depression/comments/1fwe315/i_fucking_hate_everyone_i_hate_myself_i_hate/,-0.9974393844604492,-0.9997482895851135,-0.0023089051246643066,neutral
u/ardand,119,"Feel guilty for being depressed I (30M) have no major issues in my life, good family, nice job, no debt. Currently living with my girlfriend(7years together). I've seen lot of posts here of people that have way worse than me. Im taking my antidepressants regularly, some vitamins, going to therapy weekly,  going to gym M-F every week. 

I just cannot feel happy, or in peace at least. I just feel like wasted my life, doesn't accomplished anything and made all the wrong choices. I just cant see myself in the future, cant set goals or objectives. Everyday I think about suicide and the worst is that I dont have a reason for this, I feel ashamed and guilty for being this way.",u/ardand,3,"Thanks for your comment, I guess there's more in this situation than I thought. I will try to recognize this lie | Thank you. I guess ""hope"" is the feeling that i miss the most, i just cant see it getting any better. But we gotta try... | I dont think it is the ""expectation to be happy"" in my case. I just dont have any hope or will to go after better days, or ease the suffering at least | Yeah, I too have this feeling. Like I didn't put enough effort and didn't accomplish anything, just got lucky I guess | Im taking this med for 7 years and every depressive episode was solved by increasing the dose since then (with doctor's prescription). But this time I think i will need to do something different | I relate to this, you know people loves you but you can't love yourself. We should start believing in people we love and less in that little voice. Wish it was easier for us.

What about this mugger story? | I will give a shot and seek another. Mine is great but she is too ""relationship centered""... | That sounds nice. Right now I can't focus on nice things, no matter how hard I try i keep going back to bad thoughts. But as people said here, my med must be a little off. Hope you keep this good mentality, you're doing great | I guess many of us are in this situation, based on the comments. I think that we should be less harsh to ourselves, my fellow brazilian. | I think it really feeds on itself, that voice saying bad things about you, gets stronger and you keep validating it. When I felt this before, the meds turned off that voice, but it just not happening now | Thanks for your comment, it's good to see someone who has gone through this have this feeling. | Thank you. I think that's the hardest part, what makes depression gets stronger | Thank you. I hope that voice that makes you feel guilty goes away.  *hugs back* | I guess there's a lot of people feeling this way, each one sorting their way through this. I just wish to stop that little voice saying bad things | You sound like you doing a good job. Keep going. And thank you! | Thank you, I will give a try.",1ap2dn0,https://www.reddit.com/r/depression/comments/1ap2dn0/feel_guilty_for_being_depressed/,-0.9976945519447327,-0.9951348900794983,0.002559661865234375,neutral
u/artxdecos,92,"I’m embarrassed about my hygiene  My depression has made my hygiene so bad especially brushing my teeth. I’m embarrassed to show my teeth. I just don’t know how to work up the motivation to brush my teeth when I have to choose sm other things to do just to survive yk? 

I don’t want to go on dates because even when I do brush my teeth my cavities have gotten so bad they make my breath stink regardless. It’s embarrassing.  

I haven’t been to a dentist in almost 10 years because I’m terrified of it and also embarrassed to show the state of my teeth and gums. 

How do you guys try and gain the motivation to brush your teeth or shower more often?? I’ve been keeping flossers by my bed and I at least have been flossing enough now where my gums don’t bleed anymore and I’ve tried the Colgate portable toothbrushes but I hate the taste of them. ",u/artxdecos,3,I used to be so good at taking care of my teeth especially when I had braces but the last few years I’ve been lackin and need to get better so that’s why I asked for help lmaoo | That’s actually so smart!! I’m def gonna do this tyyy! | You’re so real with the peeing cause I’ll prolong that as much as I can | Thank you!!! I love smiling friends sm!! Your advice was very nice thank you :),1fcd3fz,https://www.reddit.com/r/depression/comments/1fcd3fz/im_embarrassed_about_my_hygiene/,-0.9995988011360168,0.9996926784515381,1.999291479587555,significant positive
u/cornrebeca,238,"Tired of the “find a hobby” argument I know many people overcome depression by finding a hobby or an activity they enjoy but I don’t like anything. Not only because I’m depressed right now, but I’ve been trying different hobbies through all my life and nothing appeals to me. Not even watching TV shows, nothing. So when someone suggests finding an activity I like to clear my mind, I just can’t. Plus, I’m at a point I can’t stand living. I hate everything, I hate talking, I hate listening, I hate going out, I hate laying in bed. I hate being here. It’s unbearable.",u/cornrebeca,5,"You just described my situation. Being a slave of capitalism when you can’t push yourself out of bed and having to be productive anyway | They are, but not having any hobbies just brings you to reality and it grows a void in your life you can’t fill cause you realize how awful life can be. So I guess they ate important, but I don’t have any interest in anything. | Oh my god yes. It makes me feel I’m the weird one, the broken one. “If this is the only thing that works with people and it doesn’t with me, there must be something wrong with me”. | I wish you the very best in your healing journey. It’s painful and scary but let me tell you you’ve made the wisest decision by reaching out for help. I’m proud of you ❤️‍🩹 | Thanks for sharing your helpful resources. I myself hate the nature but going out for walks doesn’t sound bad at all. I’ve tried with some antidepressants that just worsened my depressive state though ☹️ | I’m glad to hear that you found a new interest! That is such an important achievement | Sometimes it can be really helpful to have someone to talk to. If you’re struggling and you can afford it, don’t hesitase to reach out for professional help. I know how frustrating it can be not to have an environment who understands you. That’s why it’s important that you can share your pain with someone who is empathetic with your situation | This was really really helpful. Thank you so muvh | I feel super related to your situation. I have never maintained a hobby. Since I was a kid I’ve been starting new things and quitting bc nothing appeals to me to the point to be a hobby. Therapists keep telling me to keep looking, keep trying. Hobbies are not always the solution to one’s problems. If your mind is screwed, no hobby can fix it. Why not digging into the source of the problem instead of looking for distractions? | I relate too much with this. If I ever decide to start something, it overwhelms so so so much I always end up quitting. I’m not able to enjoy absolutely anything. No matter what it is | My brother was in fluoxetine for 2 years and he barely had any worrying side effects. In fact it helped so much to cure his depression. But when I tried it, it gave me such an anxiety level and many side effects I had to quit. I also tried paroxetine but same result 😕",1g01b4f,https://www.reddit.com/r/depression/comments/1g01b4f/tired_of_the_find_a_hobby_argument/,-0.9989030361175537,-0.9962295889854431,0.0026734471321105957,neutral
u/cosmicghostriderr,215,"I just want to fucking die already I’m so tired of people saying “you could have it worse you could have cancer” like sorry if this is insensitive but I’d rather trade my health to someone with cancer so I could fucking die already and stop feeling so miserable. I have been on dozens and dozens of medications and therapy, inpatient and outpatient, TMS therapy, NOTHING WORKS. My brain is completely infected in depression since as long as I can remember. When I was 6 years old I used to draw pictures of heaven and when I was 10 I asked my mom if there was a place people could go if they don’t want to live anymore. There’s no reason for me to be here. I’m a fucking waste of life, I’m completely alone, and I’m not gonna put the people who love me in a position to listen to me complain about this anymore. I just want to fucking die already FUCK.",u/cosmicghostriderr,51,People say that but when it comes down to it most of the time they don’t really wanna listen and they just say that to make themselves seem like a better person.,1an0tyd,https://www.reddit.com/r/depression/comments/1an0tyd/i_just_want_to_fucking_die_already/,-0.9990649819374084,-0.9914461374282837,0.007618844509124756,neutral
u/cowboyzest,142,"im so angry. what the fuck is wrong with people. why is everyone such a fucking asshole. i try, and try, and try every day to be the happiest dandiest motherfucker there is and i still get beat when im down. every everyone does makes me mad. it doesn’t even have to be a big thing anymore. any minuscule disagreement and i contemplate beating someone to a pulp. ive been a pushover all my life and i think it has broken me. i am not violent but i fear i will be.",u/cowboyzest,12,i am not on any medication. i thought maybe these feelings were due to my depression but i don’t know anymore. i feel kinda crazy,18yr1ko,https://www.reddit.com/r/depression/comments/18yr1ko/im_so_angry_what_the_fuck_is_wrong_with_people/,-0.9949344992637634,-0.9971252083778381,-0.002190709114074707,neutral
u/fiZzbuZz-haveAbanana,855,"I haven’t gotten out of bed in a month I (34f) literally have not left my bed in a month other than to go to the bathroom or get food from the kitchen. I order groceries from Instacart and shop on amazon if I need something. I haven’t showered (I hate the idea of water touching my body) but I have done basic hygiene daily.
I don’t sleep all day, in fact I’m usually up by 8, but I’ll spend my days reading(multiple books a day) , or watching tv on my iPad. 
I avoid calls and texts as much as I can, I just have no desire to interact, but I do respond occasionally.
I’m unemployed and live alone so I have no need to go anywhere or talk to someone during the day.
I have ADHD, depression, anxiety, OCD, excoriation (skin picking) and I take meds daily.

I’m not sure if I’m looking for help and advice or if I just needed to share with someone what I’m going through. But if anyone has advice, tips to help motivate me or even gone through something similar themselves, I would love to know. (Please be kind)",u/fiZzbuZz-haveAbanana,39,"Financially I’m ok and as for support I have amazing friends, some who live close, who know about my troubles with mental and are very supportive and understanding. And my family is close and while I know they love me and support me, I don’t think they really understand, but I know they would drop everything if I needed them. | No, I read usually 2 to 3 books a day, and watch tv/movies and documentaries that inspire me to go down Wikipedia rabbit holes",1bdrioz,https://www.reddit.com/r/depression/comments/1bdrioz/i_havent_gotten_out_of_bed_in_a_month/,-0.9811486601829529,0.9990712404251099,1.9802199006080627,significant positive
u/hallohi_,161,"Things don' t get better, I wish I killed myself long ago last time I was happy I was 21. I am now almost 29. I So much wished I never took any medication and things ended 8 years ago. I Feel so bad thinking all that I have gone through, despite all efforts to be well. I have very bad health, no prospective for anything good in the future and everyday is a torment in the present. I wish our society would help people like me to die pacefully, instead of imposing a life of ""therapy"", drugs, consequences of drugs and even more suffering. When nothing else helped I praied god to free me, in whatever way he wants, but there is no help there too. All lies, there is no end if you don' t end It. I want to find the courage and I still don' t and I hate myself because I allow this to happen to me year after year.",u/hallohi_,3,"Well I am talking about SSRI specifically. After I was prescribed them for a few months whenI was 21, I was no longer able to feel joy or get attached to people, or fell in love and enjoy an intimate relationship with someone specifically. I lived on , but a few years later started suffering from what supposedly were panick attacks and took a different SSRI when I was 24. When I stopped that second SSRI I imediately developed BAD ocd that I did not have before, and I started experiencing numerous, unrelated health issues that have found no explanation, especially one affecting my hearing that is really debilitating and is the main cause of me writing pathethic stuff here. I can' t be sure SSRI caused my health problems of course. But I feel they ruined my mind body, and ""soul"" . The person I was when I was 21 stopped existing, And  I just say...If taking them to artificially increase my serotonine to keep me going has led me where I am now...I wish I never took them, and maybe I would be dead and in peace by now. | I got up in the morning with a lightness in my chest. I felt the impulse to try, to experiment, to see new places. I Was not scared pr thraumathized, I was brave. I looked forward to something. I wanted to have fun. I enjoyed having fun. I felt full of possibilities and hopeful for the future. I was in love love. I felt life had good things coming for me. I was healthy and free  | I am supposed to turn 29 in a couple months",1h8dc7b,https://www.reddit.com/r/depression/comments/1h8dc7b/things_don_t_get_better_i_wish_i_killed_myself/,-0.9991841912269592,-0.9491639137268066,0.05002027750015259,neutral
u/hatorachan,303,"I’m dying, and nobody is noticing it. Everyday is a repeat of the same stuff. I get up, scroll on my phone, I don’t leave my bed. My room is disgusting. I haven’t cleaned it in a month, nearing two. there’s fruit flies everywhere. I haven’t showered in, god I can’t even remember the last time I showered. Must have been a month ago. I deprive myself of sleep all the time. There’s rotten food in my room. Rotten milk. I just got out of an abusive relationship (online) and somehow stuck in another. 

My mood swings are terrible. I’m suffering from other mental illnesses i won’t disclose. I feel empty. I barely eat. And when I do, it’s junk. I have no clean dishes. I get irritated so easily. I don’t feel like living. Staying alive is a struggle. I’ve made two attempts on my life this month. Nobody notices and nobody has asked about my feelings or how I am unless they think I’m angry with them, or they’re nosy. 

I’m tired. ",u/hatorachan,25,"i will force myself to clean it sometime this week | thank yiu🤍 | thank you 🤍 | on the unsweetened yogurt part, i used to eat it with honey nut cheerios and that was just. bomb. i loved it. i’m currently waiting to hear back from disability and with that I can have someone come and clean.

on vitamins, theyre currently selling at the dollar store, so i could try and get some. | thank you, that does sound like a nice thing to try, i’m going to combine all the advice i’ve been so far and try it | thank you so much🤍 | idk what this means but this made me laugh so thank you😭😭😭 | i’ve thought of going to the gym, it is something that interests me. i just want to have the energy to do it | i’m unsure, i just want it all to be over | thank you sm 🤍🤍🤍 | oh i did! i cleaned my room today! | thank you. i needed to hear that | thank you T 🤍 | Thank you so much. 🩶🩶 | Autism | Thank you. that is a true statement. I want to be happy | thank you sm. 🩶 cleaned my room today. | thank you🩶 | not sure if you know this but sometimes people’s depression gets so bad that they end up killing themselves. | no, i’m disabled and don’t work ; i stay at home most of the time | no, i was just venting. there’s no need to be rude to me. | thank you sm 🤍 | THIS MADE ME SMILE SO HARD thank you. | OHHHH. i’m so sorry😭 i thought this was a hate comment. usually it’s trauma, or big changes in life, ptsd, other disorders or in some cases it just randomly happens. there is a lot of factors that could lead to deep depression, i know for me it’s caused by trauma and other comorbid disorders that I have. | thank you🤍🤍🤍 | no… you are being rude. it’s the words you are using. and this isn’t helpful advice, either. | Thank you so much like actually. The replies I’m receiving have been a huge motivation, and I also thank you for your contribution, and thank you for being kind to me.",1e8y1f5,https://www.reddit.com/r/depression/comments/1e8y1f5/im_dying_and_nobody_is_noticing_it/,-0.9992814660072327,0.9994497895240784,1.998731255531311,significant positive
