submitter_username,score_submission,content_submission,commenter_username,score_comment,content_comment,thread_id,url,submission_score,comment_score,improvement,sentiment_tracking_category
u/Acceptable_Panic_759,122,"Im 26 and have never experienced what’s it’s like to be loved by someone. Im wondering if I ever will. People say “it’ll come just wait!” But like how long am I supposed to wait… 1/4 of a century isn’t enough waiting? 

I just wanna know what it’s like to be loved and cared for. I want to know what it’s like to be thought about, worried about, or made a little bit of a priority. I want to know what being appreciated feels like. I want to know what being wanted feels like. I give SO much positive light to others but people just come up and use it to heal themselves then leave once they’re better. 

I feel useless or invisible or both. I just want ONE connection in my life that is genuine and my level of love, thought, and care is reciprocated.

I sometimes think my purpose is just to keep helping others, even if they leave afterwards anyway. But I don’t want that purpose or existence. If I could do it without making others sad, I would kill myself immediately. But even tho people consistently hurt me, I never want to hurt anyone.

I’m so stuck and idk how to get out.",u/Acceptable_Panic_759,8,"I mean relationships and friendships. Everyone comes to me to heal bc they know I’ll heal them then they just leave | I wish I could help you as well. I agree 100% like I wish I could just end up in a coma for a few days. Just long enough for me to rest and for people to hopefully remember they maybe care about me a little bit | Thank you. Really. | But care? Or just being thought about? Or considered? | The burglar😂😂 I’m sorry bc I’ve literally thought the same thing | I’m sorry. | I have worked so hard and done so much healing and I do love myself. I’m like pretty fantastic like if I could clone myself and marry myself I would bc I love the way I care about and treat people that I love. People are attracted me like I don’t want to sound crass but I have never met someone who didn’t like me. The problem is that everyone is attracted to my light and kindness so they come, convince me they care and love me, suck up all my love and kindness to heal themselves a bit, then leave. No matter what.",18yorzm,https://www.reddit.com/r/depression/comments/18yorzm/im_26_and_have_never_experienced_whats_its_like/,0.997811496257782,-0.995086133480072,-1.992897629737854,significant negative
u/Agreeable-Most-5407,93,"Gets harder instead of easier? Most people seem to find things they dislike doing or aren't good at get easier to deal with the longer they do them, but for me the longer I'm doing something I hate it gets harder and harder and more and more stressful until I give up. Everytime. Why does this happen to me? Why can't I climatize myself to the shitty things in life that as an adult I need to do? Why do I see other people do things like driving a car, learning to play music, buying a house, why does it seem like climbing Mount Everest to me?",u/Agreeable-Most-5407,11,"I do. I take Vyvanse for it and it helps to a degree but it isn't a fix. And if I get a day like today where I ran out of my pills and can't get a refill in time, it makes me feel like a useless person. It bothers me that psychopharmacology still hasn't found a better fix for it other than giving patients speed. | My biggest fear with driving isn't hurting myself but doing something stupid that gets somebody else hurt. Messing someones vehicle up would be bad enough but accidentally maiming someone or killing them, i'd never forgive myself for it. Hard to wrap my head around driving a large metal missle down the road at 100 km per hour | Nah they can't unfortunatly, amphetamines are controlled and they won't give you small ammounts like that to make it to your next refill. I appreciate the kind words though, doesn't hurt to read when I'm feeling this way.",1cu6pjb,https://www.reddit.com/r/depression/comments/1cu6pjb/gets_harder_instead_of_easier/,-0.9982049465179443,-0.9994901418685913,-0.0012851953506469727,neutral
u/Alone547,143,"I'm thinking about committing suicide this week My parents are traveling this week, a great opportunity to try something... I'm just finalizing my music album.

In any case, I'm not sure that I'll be able to kill myself, maybe I can... I want to leave some things to my family as a keepsake. I'm exhausted from everything around me, weakly I don't see a future in my life, so... Ending everything is better.

The fact that I have great support from everyone who loves me irritates me, because I feel that I don't deserve their help, there are so many people with problems that are much worse than mine. The truth is that my depression doesn't only affect me, but everyone who wants to help me.",u/Alone547,7,"I understand... Unfortunately I don't know what to say, I find myself in the same situation | Thanks for the support! I'm trying to rely on music, which is one of the few things that still bring me relief | It's a real daily battle... An immense exhaustion, which takes away all your 

 I'm completely tired | I'm very tired of everything... But I am very grateful for the support, I will try to continue to find hope to live. | I understand, I'm trying to believe that I deserve this! Even though it's very difficult. | I appreciate it! I am very tired, however, I believe that everything will get better | I hope! | I think a lot about these possibilities, but I want to do something that is impossible to do wrong | I understand, but I really can't see a future in my life. I want to believe that I will be able to enjoy true happiness... | I understand, however, that's not what I see. My mother constantly cries over my situation, it hurts my heart. | I can't say many things, in fact I'm in a similar situation | I understand... One of the only things that still bring me a certain amount of happiness is to make music, to express myself through that medium. | Okay... Thank you very much for your attention! | Oh, that's my intention, I want more people to be able to identify with my experiences",1fpt5ko,https://www.reddit.com/r/depression/comments/1fpt5ko/im_thinking_about_committing_suicide_this_week/,-0.9968919157981873,0.993615984916687,1.9905079007148743,significant positive
u/ArmchairDoorknob,88,"I hate the world at this point 29, bipolar depression is kicking my ass. I was ok this morning then boom back to feeling like I want to smash my knuckles apart on a tree, or worse. Already fractured my hand last week due to stupidity and a fractured cervical vertebra from an accident. In the span of 2 weeks, I lost my car, lost my job, lost my dad, back to living with my mom after taking a break with my girlfriend of 2 years. I hate society, I hate myself. I want to go to sleep and not wake up.
How to keep from hurting myself? I don't want to die, but I see no light, no hope. Only pain and heartbreak. It's only a matter of time. ",u/ArmchairDoorknob,8,"Thank you so very much, kind stranger. I've seen the light before, I'll keep searching for it. I just have to keep telling myself it'll come, regardless of how bad my episode and situation is. | Fortunately I don't have access to guns",1azttae,https://www.reddit.com/r/depression/comments/1azttae/i_hate_the_world_at_this_point/,-0.999175488948822,0.6523335576057434,1.6515090465545654,significant positive
u/BeverleyGoldberg,131,"I don't want pity - I just can't see the point anymore? I'm 43 - a woman.  My husband had a major stroke 19 months ago.  He was so badly affected he is now pretty much my 6 foot 2 son.  I have tried EVERYTHING to help him.  He is mobile, but his brain injury is so bad that he is often like a 5 year old child.  I grieve desperately for our old life.  It feels like it has only hit me in the last couple of weeks that it is NOT going to get better.  It has been so long now, and we have tried all the jigsaws, and wordsearch puzzles, that he isn't able to do because he can't understand them, that I am just done.  I am so sad and low and depressed all the time.  I have gotten pissed (drunk) tonight because I feel so shit.",u/BeverleyGoldberg,47,"I don't get WHO we are carrying on for.  I have a daughter who is 21 and I think the only reason I haven't snuffed myself is for her. | I don't know what the point is.  I'm not being dramatic, or seeking attention, I just genuinely don't get the point.  My Dad is gone, my mum is 80, so I feel like I can't do it to my mum at her age, but otherwise, who am I living for?  We have no money, since he can't work anymore, can barely make the rent.  Why? | I would happily snap out tonight. | Genuinely, thank you for responding to me.  

We have carers for the lunch-time.  

He has become so reliant.  He was the man, who 2 years ago, built our entire outdoor space, with a pergola.  Now he asks me if he needs to brush his teeth.  Hence, why are we bothering to live? | Well, thank you for replying to me, I do appreciate it!  However, 43 is not 'young' and a grown kid of 21 is not a 'young child'! | No.

He isn't ""that bad"".  If he was, I could not condemn to that.  He is just the child I didn't want. | Thanks :)

I think, stupidly, I thought time would make it better.  And it DOES (in case anyone is reading who is affected by stroke) - but not when the brain damage is this bad :-/ | My sister is of the same opinion.  I still have hope.  Although, I am switched on enough to know that my hope is in vain.  We have been together for 20 years next year.  I can't imagine moving on.  
Thanks for replying by the way.  To my pathetic, attention seeking post. | I was really offended by your comments at first.  Just because it was personal.  Yet, I feel the same way.  He has had another episode of a major seizure last Sunday and only came out of hospital last night.  I know, knew, the man he was.  The life he has now?  He'd rather be dead. | sorry, what does this mean? | I want to join him in death. | for who?  WHO are we living for? | i think im done | Oh I am sorry :-( 

I have no words. | We are in the UK.  We get some monetary assistance, and I have JUST been offered a new job.  It is full time, and I am scared to death of leaving him 8 hours a day, but it's either that or we lose our home. | Even if I wanted to, which I don't, it costs ££££ which I don't have. | I can't afford a care home. | The only other life, is the life in which I leave him behind.",1f595ed,https://www.reddit.com/r/depression/comments/1f595ed/i_dont_want_pity_i_just_cant_see_the_point_anymore/,-0.9985573887825012,-0.7803391218185425,0.21821826696395874,slight positive
u/BoysenberrySmall9952,110,"Do hookups cause depression? I lost my virginity 7 months ago and have had a lot of hookups since then, at first it felt great, but now im depressed and it seems im just using hookups to get a short high feeling again. Does anyone have experience/advice for this?",u/BoysenberrySmall9952,1,"Thank you | Positive energy i need in my life | Im a guy so i doubt im really being used | I believe you will find the right person, just dont throw up a facade for someone | Tinder bumble and hinge is where i found 90% of my hookups, if that is the path you want to take, best of luck | Im not sure what you mean by this? | Hookups dont help with loneliness | Take a gander | I agree that i would rather have sex than die a virgin, but everything is good in moderation | Idk man | Then be very straightforward with women and say you only want casual sex | Im severely autistic lol | It be like that sometimes",1d6v5fh,https://www.reddit.com/r/depression/comments/1d6v5fh/do_hookups_cause_depression/,-0.9978476762771606,0.9986483454704285,1.9964960217475891,significant positive
u/CommunityHead838,497,"I died a long time ago I smile, I laugh. But I'm not happy. I've never felt excited for anything. I don't wake up to be awake, I wake to be in darkness again and sleep. Pushed all my friends away and had no family. Life is fucked.",u/CommunityHead838,5,I used to love chess. I used to make games and do python. Not anymore though I just do nothing. It's funny you said chess and coding cause those used to be hobbies of mine.,1dsn9zy,https://www.reddit.com/r/depression/comments/1dsn9zy/i_died_a_long_time_ago/,-0.9953173398971558,0.8498318791389465,1.8451492190361023,significant positive
u/Darth_Jar_Jar,818,Finally let my wife know I was suicidal and she told me to essentially man up and figure it out myself… Yeah I’m done. She told me to go get help and figure it out myself. No real compassion at all from her at all. I really hate being a man. I know what I must do now. ,u/Darth_Jar_Jar,60,"Thank you that made me tear up a bit | I don’t see an option. I don’t have the money, time, or energy to try something different. I’m just trapped essentially. | I don’t believe it will. I’ve tried so hard in my life and nothing ever works out at the end. I’m so tired and I can’t do this any more. I’ve never had any power in my life but I do have the power to end me and that gives me such relief. I will be free. | I still love her. it’s just heartbreaking how she reacted to me… | That would be nice. | We live in an unjust world. Men are people too and we have emotions as well. It would be nice to be heard sometimes instead of being used as a tool to get resources and if we can’t we are worthless to society. Humans suck! If there is reincarnation I do not wish to be human again. | I’m sorry you feel the same way. 40 is not old btw and being a mom is the most important job in the world. | I have no support but thanks. | Yeah it’s just upsetting is all. At least it won’t be some total shock to her later on. | That’s not an option. I love her and we have made a life together. | I’ve been numb for awhile | Thanks you | I’m coping much better now. My wife and I have talked things though and I feel that things will be ok for us. I am happy to report that I have been sober since the incident and I am looking at over 10 months now! I’m really trying to work on myself and be the best person I can be. | No offense but you are being toxic and putting a different spin on man up and handle it yourself. Simple compassion is all I wanted. | I will check out this book thank you | I have no offspring. I wouldn’t bring anyone to this world. | It’s a mix of everything job losses, new found poverty, legal issues, isolation, addiction, depression and anxiety. I’m 43 and I just can’t start over again, I just can’t. I’m all out of fight. | I just don’t have any fight left in me. I’m so tired. I will check out your book suggestion. Time is on my side at the moment. | Yeah it’s just that easy… | Thank you for your encouragement | I wish I was a cat… maybe in the next life… | It is what it is… | I can’t afford a doctor I’m already cash strapped working 3 jobs at the moment after getting laid off last year from my two good ones. I don’t want to paint my wife as a villain or anything. She is a wonderful person and I love her so much, but that’s why it hurt so much. I just wanted to be real for a moment and that’s what I got for it… | Nah your not useless at all | I would love to go back to school but I’m in America where there are no free resources for middle aged men 😂 | I will check this out for sure | I wish that could be an option | Thank you for the resource | It’s not that easy we have a life together",1bum6er,https://www.reddit.com/r/depression/comments/1bum6er/finally_let_my_wife_know_i_was_suicidal_and_she/,-0.9973195195198059,0.9899498224258423,1.9872693419456482,significant positive
u/DedanNaded,152,"Depression makes me dumb I personally feel like my depression is making me more dumb as time goes on. I saw that someone else made a thread here titled the same, so I don't think I'm the only one that's come to this conclusion, but maybe they and I are the only ones to have noticed it and have taken an issue with it, but it's fucking terrible. 

My brain literally will have chunks of time where it's doing nothing and I can't bring myself to do much more than doomscroll when that happens. Conversations are nearly impossible because I don't have the mental capacity to cook up responses that aren't just dumb word play jokes. 

I don't know, maybe I'm taking my own illness harder than I should, but it honestly kills me that my brain is regressing as it is. I use to write novels on a site called ""MobaMingle"", but I can't even work my brain hard enough to do that.",u/DedanNaded,1,"This also has really negatively impacted my ability to bounce back from losing a job and also get another job as well as being on the verge of homelessness. I'm currently staying with my sister and her husband, but they keep stretching about how this is a temporary thing, and I understand and greatly appreciate it. I am actively putting putting in applications and resumes,  and my sister's husband keeps recommending I call them up, but it's like... what do I even say? Other than the obvious, I don't have any thoughts as to gussy myself up | Yeah, I've only tried antidepressants for a week. I'm a type 1 diabetic and that just adds to the side effects and of course I hit every one of them, and now I'm learning that they don't even really help in the ways I want to be helped. It's a coin with 2 losing sides, it seems | I don't recall stating my age, but I'm almost 31 in Oct (I don't quite believe in the guy, but God willing), and very similar to you, I was call really smart growing up, an old soul some times, more wise than most my age - got a lot of A's and B's until 7th grade, when my mon decided to leave the country for her current husband, and I lost all motivation to complete school. I've faked having a diploma all my life, but only going after entry-level positions until my last job, which had many doors for growth. I don't know what happened, but for the 2nd time in my life, I was fired without warning or reason. For 5 months, I busted my ass and did everything that was asked of me, hoping to actually have a career and do something with myself. One day, I was pulled into the office, and they told me that I was a good worker and that they'd be more than willing to be a good faith reference on any of my future applications,  but I didn't fit the growth of the company. Since then, I've probably put in 50 applications and resumes, but I'm running out of time, and I'm on the verge of homelessness - which is honestly endgame for me as a type 1 diabetic. | I have never said anything with more conviction, but I 100% feel this | When things were going well with me, I actually found that ashwaguanda(sorry if that's wrong, but I'm on mobile and autocorrect doesn't recognize it and bouncing to Google is a pain) seemed to help a bit, but I might have been just distracting myself as I often do with work",1e96dyc,https://www.reddit.com/r/depression/comments/1e96dyc/depression_makes_me_dumb/,-0.9996644258499146,0.9806764125823975,1.980340838432312,significant positive
u/Depressed_Jerkoff,96,"Depression and Masturbation...? Delete if not appropriate, my apologies.

My (28m) partner (27f) just left me after five years and i can feel myself falling into a deep depression. I will spare the greater deatils but things have been so incredibly difficult for me the past two months and i feel completely traumatized. Nothing feels important. nothing feels worth it. And i am fighting back panic attacks 24/7. I have a lot of friends and a lot of distractions but it all feels so hollow without her in my life. I am not doing good at all. I have started seeing a therapist.

With all this going on i have somehow started masturbating way more than i ever have before. Multiple times a day, surpassing what was a normal amount before. Every time i do im just thinking about how much I miss being with her and longing for what I had just a few months prior. its a cycle of having my mind race, thinking about her, thinking about the physical times we had together, the times we could be having right now, missing those times, getting horny, masturbating, thinking of her, relieving myself, then sitting there realizing i am a complete emotional disaster right now. Has anyone else experienced this? This increase in sexual thoughts and desires while going through depression? I cant seem to shake it. Even worse Ive gone back to old pictures and videos of us fucking while masturbating, knowing very well how unhealthy that is. I have stopped doing that but im sure ill be stupid and do it again. I am a fucking mess.",u/Depressed_Jerkoff,1,Thanks everyone | Youre right. Porn is always in immediate access. Maybe i should try and stop watching it. Thanks,1boegvg,https://www.reddit.com/r/depression/comments/1boegvg/depression_and_masturbation/,-0.9994572997093201,0.9969195127487183,1.9963768124580383,significant positive
