submitter_username,score_submission,content_submission,commenter_username,score_comment,content_comment,thread_id,url,submission_score,comment_score,improvement,sentiment_tracking_category
u/Endless_paranoia,401,"I couldn’t care less about this world anymore  I don’t care.

I don’t care about my education, I don’t care about getting a job, I don’t care about any future prospects, I don’t care about my health nor care about my life in any capacity whatsoever. I don’t care about relationships.

I can’t bring myself to care about anything in life. 

All I want to do is lay down and do nothing till I pass away. I am sick and tired of everything. I just don’t care at all. 

I never understood how everyone else could find whatever it is they want to do in life and care about it. I never cared about anything I ever had to do, and could never bring myself to care no matter how hard I try. It sucks. This sucks. If I can’t find meaning in life then why the fuck do I bother.",u/Endless_paranoia,35,"Yeah that’s been pretty much what I’ve been doing for the past 4 years.. Damn | I’m 23, I guess this is a very common mindset to have in our generation, none of us have anything meaningful to live for. Our future has been robbed by climate change and our perpetually increasingly difficult economy.

It is disheartening. | No, I don’t have any friends and I don’t feel anything with my family anymore | I feel you, it sucks hard because you can never fit in with everyone else because of it too. Forever unable to understand their passion for life and trying to achieve the best, whatever that may be | Real. | Same here, I’m never seeing or meeting anyone in my life time, I’m far too unstable to have any sort of relationship with anyone anymore. | From my perspective: I’ve felt this way for as long as I remember, but had none to speak to about this.

I sort of never cared until I witnessed the lives of my online friends over the years changing for the better.

One my friends graduated with a bachelor’s degree and was able to get a good job at a big company, another friend was able to start a business relatively young and it went well for them, one got married to the love of their life and moved in together. Everyone else seemingly able to get their lives together except for me.

That’s when it hit me. I was truly alone. I was stuck with nothing and nobody. I was completely stagnant. I was the only one who had such deep frustration from within towards life. I spent my life in deep isolation and repression and anger that I had realized that I wasted my life wallowing in my own misery unable to care about myself at all. 

I felt jealous. Jealous that they have a desire for life that I never had. I sabotaged my relationships and cut contact with all of them because it brought me so much pain to see them be happy.

That there’s nothing wrong going on and everything was perfectly fine. It made me despair. 

I suppose that’s what made me angry, what made me come out of my usual apathetic uncaring state.

I never cared about myself because I always hated who I am, and was never able to reconcile with myself about that. I became mostly numb about my own life, because I could always take myself out so it didn’t feel so bad.

Its just lonely to see others chase their own happiness while I cannot. I’d feel far less miserable if I could sign my own death warrant immediately than sit around and forever torment myself with the lives of those around me. | I read about that too, but it’s very hard to do especially when you don’t live alone. 

It can take up to a week to be effective which is much too long | I know. Your shrink is an asshole by the way. I hope you stopped seeing him. | We’re failed experiments, not the ideal humans. We’re nothing but cannon fodder. We’re just side characters in another person’s story. | Years of social isolation forbid me from trying to associate with other people in any social setting, im unaware of any volunteer activities around me and prefer not to engage as I feel utterly uncomfortable thinking about them, I just don’t have the energy to speak to other people at all | I honestly do these things too but not for the same reasons, I do it because I pass the time, I don’t feel the intrinsic joy in them. Not anymore at least. | What if the spark never ignites?

I don’t really have anything or anyone in my life that matters to me deeply, I don’t remember the last time I was truly happy, I’ve been angry and bitter at the world for as long as I remember. | I don’t have anything like that around and my parents are absolutely against any sort of pets in the house. | I’m sorry to hear about your struggle. You just have to keep it together for your pets, you are their world after all and you can’t abandon them. 

You have to stay alive for them, and who knows.. something good may happen along the way | Religion is part of my problem to be honest. | True | I can’t rely on false hope to be happy. It seems much more cruel to continue on a path that is uncertain for me. 

1. It’s so long ago that I genuinely don’t remember it, but I understand what you mean. 

I would say the only reason I was happy then was because I was a child. I had no responsibility and my view on the world was completely different.

2. How? Because I’m not trying to meet people. I feel utterly detached from everyone around me. Everything feels superficial and especially trying to pretend everything is fine in order to make friends with others is very hard.

3. I genuinely cannot feel anything when I watch those videos. There’s far more cruelty out there happening that it out does the kindness happening  in the video tenfold, I can’t help but be pessimistic about it.

4. I barely take care of myself, let alone take care of another animal. I would neglect the pet and honestly I don’t want that for them. | That’s okay, I appreciate your help thank you!",1hmq80l,https://www.reddit.com/r/depression/comments/1hmq80l/i_couldnt_care_less_about_this_world_anymore/,-0.9994787573814392,-0.9993894100189209,8.934736251831055e-05,neutral
u/EntryWoundExitWound,104,"I hate being alive I'm 23 and i have no desire to live  and can't remember of a time when i did.I hate everything and everyone.I fantasize about blowing my brains out all day and just the thought of it is comforting, unfortunately i do not have a gun and I'm too much of a coward to do it another way. I'm fed up of waking up, I'm fed up of going to work , I'm fed up of seeing all the same stupid faces everyday and wish death upon them. I'm fed up of going home from work , I'm fed up of having to shower , brushing my teath , going to the bathroom, having to eat , having to drink , I'm fed up of having to sleep.Nothing brings me joy and my face has no emotions.Nothing interests me in life,  the only ""hobby"" i have is making music and i barely have the motivation to do so, my free time off work cosists of me laying back on my chair listening to music and staring at the ceiling for hours.
I go to a therapist every week and take antidepressants , the only reason i do so is so my mother would shut up , i don't expect it to work.
Everyone says "" you'll find a reason to live "" i really don't think that's the case and even if i do "" find it "" it doesn't fix anything , i want nothingness, pure nothingness, to have never existed.

I'm sorry if this is hard to read , I'm bad at writing stuff and even worse at expressing myself",u/EntryWoundExitWound,7,"The only thing I kinda like it's music but not to the point of making me want to live.On why I'm hesitant to do it is just cause it's in my stupid human nature to not hurt myself, I truly wish to overcome that stupid instinct. Thank you for commenting  | I just came back from the doctor , he doubled my dosage | It's not worth living though | I appreciate your comment thank you ",1dclqcm,https://www.reddit.com/r/depression/comments/1dclqcm/i_hate_being_alive/,-0.9870571494102478,0.8626524209976196,1.8497095704078674,significant positive
u/Financial_Loss2013,264,"I just wanna rot in my bed till I die 've been experiencing so many breakdowns lately, and I can't quite understand why I'm crying despite my efforts to hold it together. This overwhelming sadness just won't lift. I worry that I'm burdening my loved ones, and it feels like everyone is looking at me with pity. I have no motivation to do anything; all I want to do is lie in bed all day. I don't feel like eating or engaging in any activities. I really hate feeling this way.",u/Financial_Loss2013,14,"Yeah. A lot of people dont take when I say this seriously as well. | Thank you very much for understanding. 

I try to do things that make me happy but even when I get happy it lasts for some time and then I am back to all those negative thoughts. I hate it. I hate living this way. Like you said meds do take some time to kick in, It is just I feel this immense pain, I really want it to go as soon as possible, I know it is not possible cause even meds are a temporarily relief but I dont know what else to do. I really want my brain to shut down for some time so that I can feel peaceful. Life has been very exhausting every single day. I have to get myself to do things. I really dont want to do anything. I hate this. Idk | yeah, I feel that way too. Like no matter what I try to do, I dont see why I exist. I feel like I make things worse | Yes. I do wish things were different. | Thank you very much! | I am getting treatment. I went to a psychiatrist and she has prescribed me some meds and I am currently on it. I dont see a difference, so I am planning to visit her again. 

Thank you very much.  I hope it does get better. | I hope you get better too. Thank you | I understand, I dont know who I am anymore too. | I did go to a hospital recently, I was prescribed meds. I have been using them i dont see any difference. | Yeah I am medicating. I am currently using escitalopram. I don't see a difference after I started using it as well. 

I have this random breakdowns like I cry so much I cant understand why I cry at all. I just want this pain to go away idk | Thank you very much. You arent too. | I hope things get better for you as well. I hope we get better. I really do. | I really do understand. I dont feel connected with my surroundings as well. My psych told me that I am deattached from my surroundings, no matter how hard I try to pay attention I am not able to. I feel like all i ever wanna do is lie down in my bed and do nothing. Nothing that i do is giving me happiness. I feel really exhausted all the time. I try to show myself empathy too but I guess I dont like myself too. 

You deserve it too. I hope you get better. I really do. | Hey thank you, i ll try doing something new | Only if it was that easy. | Yeah. And It is just no matter how much i try to figure out why i am sad, i just am not able to. Everything feels exhausting. Everything feels like a chore. I really was hoping with meds I ll feel some what different and i am disappointed i dont see a difference. I feel worse to be honest. I dont know what to do anymore. 

If I know why I am like this, i can work it but I dont. So i really dont know what to do. | Exactly! This is exactly how I feel. I just wanna close my eyes or just lie down in bed and do nothing forever. | Yeah I totally understand. I really hope it does get better for you and me. I really do. I hate living like this.",1gn5mmj,https://www.reddit.com/r/depression/comments/1gn5mmj/i_just_wanna_rot_in_my_bed_till_i_die/,-0.9994415640830994,-0.9832127690315247,0.016228795051574707,neutral
u/Financial_Might_6816,95,"How do I know if my friend is Suicidal I have a friend which I’ve known for 4 years and I’ve just learned that he was depressive and that he sometimes cuts himself. 

About his life: To be honest it’s pretty fucking miserable, he never takes anything seriously, he has the worst grades possible, he just goes to school to do nothing. I’m also concerned because he has the hobby to completely destroy the school toilet, I know this might seem funny but he literally made the school pay 300k € because he made a flooding in the school and the police are investigating. He also has a problem with porn (again might seem funny but I’m worried) he regularly sends extremely brutal pornography or people having sex with dead animals,he also has the problem that he doesn’t care abt his body att all, idk if he regularly drinks alcohol, but recently he emptied an entire bottle of some liquid (stuff to rinse your mouth) to drunk himself, he apparently puked 3-5 times.
Idk it might seem ridiculous to many people but 

I’m actually really worried abt his future and I wanted to ask, how can I know if he is suicidal?
",u/Financial_Might_6816,7,"Thanks, I’ll try to do that, the thing is he doesn’t take things seriously, even the others in the friend group didn’t take that seriously, he also told me to stop acting like I’m his mom when I showed that I was worried | Hi, thanks for the advice,
The problem is, that he doesn’t want to talk about it, I mean he kept it a secret for 4 years and regretted telling us immediately. Plus when I showed that I was worried he told me to stop acting like I’m his mom. I also feel like it’s hard to have a serious conversation with him because he never takes anything seriously.

I don’t see why I should tell this to an adult, what are my parents gonna do | Aren’t there any signs or red flags? | He is 15 and about to become 16 this year. He’s already on meds so his parents know about his depression | The fuck you mean stay away from him, I’m not a fucking asshole, it’s because he is like this that I want to stay friends with him, I want to help him. Plus I feel like his parents aren’t the best at this. And I don’t care if it might harm me a little, I’d rather have it to harm me a bit than letting him harm himself | No he doesn’t make jokes abt being suicidal nor about being depressive, it’s just the way he talks about it, doesn’t seem like he takes it seriously or he doesn’t want us (the friend group) to take it seriously | Damn, I hope you’re doing better now have better friends, the only advice I can give is that music never failed to make me feel good, especially if you create some yourself | He’s already on meds apparently, so his parents are aware I’m just worried abt his future.

Thanks for the advice, I’ll talk to him | I don’t know if he is in therapy I’ll ask him or his parents, but I never really see his parents | The thing is, he didn’t have friends before entering our friend group and I’m afraid that it’s just gonna get worse if he is alone | 1. My friend is probably the most harmless guy to others
2. I want to stay his friend to prevent that from happening",1c36rnm,https://www.reddit.com/r/depression/comments/1c36rnm/how_do_i_know_if_my_friend_is_suicidal/,-0.9986881613731384,-0.9992940425872803,-0.0006058812141418457,neutral
u/Foreign-Ad210,112,"Fuck therapists Cant even talk to one, they ALL hate me too I guess at least I tried",u/Foreign-Ad210,3,"Thanks everyone for the kind words and suggestions, I didnt expect this amount of comments at all and just that already made me feel a lot better ❤️ | Thx, I will keep trying | Thank you 🙏 | They like regular people that are easy to work with, they dont like people with heavy trauma and abuse | I did, now I tried to reach back to her again, she couldnt talk to me due to vacations and gave another therapists number, so I tried this new one and she told me she is going to xmas in her mom city and didnt had schedule, my mom died when I was 4 and listening to her audio telling she was going to her mom house for xmas fucked me pretty hard | Do you think I should be more direct with them? Once they tell me they dont have schedule I dont have the courage to say Its an emergency, even tho I thought It was obvious because I told her Im cold turking weed (they know how depressive It can be right?). Thanks for talking to me, It helps when I put in words what I am feeling",1hl4h7m,https://www.reddit.com/r/depression/comments/1hl4h7m/fuck_therapists/,-0.9989091157913208,-0.9206081032752991,0.07830101251602173,neutral
u/Friendly_Manager_498,93,"What's the point of life anyways? We just get born here, trying our best to keep our bodies from rotting, all the while convincing ourselves we are far from the inevitable blackout. 
The people around us are all fighting their battles, no one gives a flying fuck what we feel",u/Friendly_Manager_498,2,Live and do what? | What do you believe you should be doing?,1dxqy5r,https://www.reddit.com/r/depression/comments/1dxqy5r/whats_the_point_of_life_anyways/,0.6239044666290283,-0.9808308482170105,-1.6047353148460388,significant negative
u/HummingbirdsAllegory,111,"I genuinely don’t see the point in living past 35 I mean even now at 30 I feel like I’m pushing it. Unless you get snatched up before 22, it seems the genuine consensus is you are a worthless expired old hag. I’ve never even beautiful so what’s the point?

I am still talking to somebody but it’s hard to imagine anyone finding me attractive as an ugly worthless hag ",u/HummingbirdsAllegory,13,"I’m sorry to hear that. That’s what I’m scared of about entering a relationship, putting work into it for months or even years only for it not to work out. I already am suspicious about anyone actually finding me lovable or even remotely attractive. It’s just scary to think about",195im4y,https://www.reddit.com/r/depression/comments/195im4y/i_genuinely_dont_see_the_point_in_living_past_35/,-0.9985445737838745,-0.9962691068649292,0.0022754669189453125,neutral
u/Jazzlike-Office-5901,160,"Every time my wife speaks to me I want to kill myself The title. I don’t know what to do. I’m depressed, been this was for a long time. Suicidal as well. Normally I’m pretty good at masking, but holy fuck for the last few months I swear anytime I hear her voice I’d rather die than have the fucking talk with her. “Can you excuse me while I go blow my brains out?” Kind of thing.

Divorce and therapy is not in the cards. I just want to rest, no more pressure, no more need to act fine or happy when I’m the farthest thing from it.

Edit1: the way she says things to me I think. She has no love for me, only resentment. She just gets angry when I try to set boundaries. When I tell her that her words are hurting me. When she argues with me and just repeats things over and over and over and I try to explain that I’m emotionally broken and at my limit. When I’ve done something wrong she says I’ve down it 80000 times, she always exaggerates how many time or how often things happen.

Can’t separate, no money to support two households. No family or support structure to fall back on. Three kids that need a lot of care. 

Edit2: somehow a bunch of people are confused and think I hate my wife and kids. That’s not the case. My kids are more precious to me than anything. I love my wife but I’ve been beaten down and don’t see a better way out.",u/Jazzlike-Office-5901,-220,"Ngl that is a little creepy. Individual and couples therapy would be amazing. We each have issues that need work, and we have issues together that need work. It’s very expensive though.",1gz73kz,https://www.reddit.com/r/depression/comments/1gz73kz/every_time_my_wife_speaks_to_me_i_want_to_kill/,-0.99891197681427,-0.6240301728248596,0.3748818039894104,slight positive
u/Just_Katsuki,464,I wish I killed myself when I was 16 I thought life would get better. Once I was out of hs I thought I'd be free. Here I am at 25 feeling the same way. I have crippling social anxiety that has got me fired from my last 3 jobs. I don't want to find another one bc I know the outcome. My husband is stressed with bills and looks at me differently. I wish I killed myself when I was 16 I was wrong for having hope. I wasn't meant to be here. Medicine doesn't help. Therapy never lasts. I feel like a fly in a glue trap waiting to die.,u/Just_Katsuki,6,Many hugs my fellow Redditor. I hope brighter days find us | I would love to have a stay-at-home job one day. Most of the ones I could get are customer service which I hate phone calls. I'm trying to teach myself to code but idk if anyone would hire me without a degree | No but may I ask what that would do? | I thought I would be free after high school because of home life. My parents didn't understand my social anxiety. I was just screamed at every morning for struggling to get out of bed. I was dragged by my dad many times. I was blamed for giving my mom stress and anxiety. My mother was hard to live with. Anytime I tried to tell her how I felt she told me to get over it. I didn't have any friends in high school I was the quiet art kid in the corner. I was bullied for only wearing sweatshirts and sweatpants but that's what I slept in the night before and that's how my dad dragged me there. I now have a loving husband who has helped bathe me when I get really bad depression. He keeps me going and it breaks my heart that I still feel this way. I feel like if I killed myself sooner b4 I fell in love with him he would have a better life right now.,1dho216,https://www.reddit.com/r/depression/comments/1dho216/i_wish_i_killed_myself_when_i_was_16/,-0.998596727848053,-0.9963437914848328,0.002252936363220215,neutral
u/L0st7777,377,"Cancer Never used Reddit before but here goes. 26 M here I found out I have cancer about 2 months ago and will not live to see next year. The only person I don’t know how to tell is my girlfriend of 4 years who I was going to propose to this year, I just cannot bear the thought of telling her there is nothing that can be done. I do not have any other significant people in my life as I don’t know my mom and my dad and little brother passed away about 7 years ago so my girlfriend is all I really have and she is the absolute most amazing person in the world and I love her with all my heart. Im so heartbroken but I’m thinking of just breaking up with her and not telling her why, that way at least she can just hate me and move on rather than love me and be stuck forever, i just don’t want to cause her more pain than I have to. What should I do please give any advice",u/L0st7777,67,"OP here. Thank you all it really made my day knowing there are people out there who care. I read what was said about my situation with my girlfriend and I guess I’ve decided to think about it, maybe it will be better sharing this burden with her even though it kills me inside that I’d be putting something like this on her as I feel like I am just dead weight and will just only make things worse for her in the long run. For whoever asked as well, I have a brain tumor called glioblastoma and I was told treatment can’t cure it just keep me alive longer",1af1nb9,https://www.reddit.com/r/depression/comments/1af1nb9/cancer/,-0.998072624206543,-0.9916456341743469,0.006426990032196045,neutral
u/L1lyRa1n444,146,"How to stop being so fuckin lazy I cant do anything, it makes me feel physically ill when I try to do anything I become extremely exhausted and unmotivated to do ANYTHING I can’t be bothered brushing my teeth , I have antidepressants adhd meds ect but i genuinely need real advice bc I hate doing anything I really need help please give advice ",u/L1lyRa1n444,3,"I should be in therepy, however I have been in it for 6 years and I cba anymore bc I keep getting passed about , I have done cbt therepy, schema therepy,walking all of it and it doesn’t seem to help, I feel like I’m hopeless, I have autism aswell and with the adhd i just find every little thing overwhelming I just want the secret that everyone that has recovered how they did it bc personally nothing helps🥲 | It really does like I cant do anything I just want to have the normal amount of motivation like everyone else | This made me smile and cry I bit I wont lie, this made me feel better because I do want to do things I just can’t and this made me feel better bc I just keep blaiming myself | Yeah I’m so proud of you for doing that , that’s a really big step your body will defo appreciate it ❤️❤️ | Im a really picky eater and I just eat crap, I have 5 sugars in my cup of tea it’s ridiculous and I don’t like the taste of anything healthy or I just know I wont like it I wish I could eat healthy | Im already dignosed im on mediknake sorry i cant spell it",1dcsq7j,https://www.reddit.com/r/depression/comments/1dcsq7j/how_to_stop_being_so_fuckin_lazy/,-0.99518883228302,-0.9927017688751221,0.0024870634078979492,neutral
